{
  "messageId": "11111111-1111-4111-8111-111111111112",
  "contract": "identity.effective-authority-evidence",
  "contractVersion": "1.0.0",
  "occurredAt": "2026-09-14T12:00:01Z",
  "tenantId": "22222222-2222-4222-8222-222222222222",
  "correlationId": "33333333-3333-4333-8333-333333333333",
  "sender": "identity-policy",
  "classification": "immutable-audit",
  "payload": { "decision": "deny", "error": { "category": "denied", "code": "AUTHORITY_DENIED", "message": "Authority was not granted.", "redacted": true } }
}
