{
  "messageId": "11111111-1111-4111-8111-111111111115",
  "contract": "case.command",
  "contractVersion": "1.0.0",
  "occurredAt": "2026-09-14T12:00:04Z",
  "tenantId": "22222222-2222-4222-8222-222222222222",
  "correlationId": "33333333-3333-4333-8333-333333333333",
  "sender": "case-runtime",
  "classification": "immutable-audit",
  "payload": { "error": { "category": "conflict", "code": "STAGE_ALREADY_ADVANCED", "message": "The Case is no longer at the expected stage." } }
}
