{
  "messageId": "11111111-1111-4111-8111-111111111118",
  "contract": "operations.audit-evidence",
  "contractVersion": "1.0.0",
  "occurredAt": "2026-09-14T12:00:07Z",
  "tenantId": "22222222-2222-4222-8222-222222222222",
  "correlationId": "33333333-3333-4333-8333-333333333333",
  "sender": "operations-control-plane",
  "classification": "immutable-audit",
  "payload": { "subject": "[REDACTED]", "redactionReason": "secret-evidence" }
}
