{
  "messageId": "11111111-1111-4111-8111-111111111119",
  "contract": "lifecycle.solution-package",
  "contractVersion": "2.0.0",
  "occurredAt": "2026-09-14T12:00:08Z",
  "tenantId": "22222222-2222-4222-8222-222222222222",
  "correlationId": "33333333-3333-4333-8333-333333333333",
  "sender": "solution-lifecycle",
  "classification": "restricted-operational",
  "payload": { "error": { "category": "invalid", "code": "CONTRACT_VERSION_UNSUPPORTED", "message": "The contract version is not supported." } }
}
